{
  "$schema": "https://json-schema.org/draft/2020-12/schema",
  "$id": "https://github.com/linktrend/LiNKlibraries/schemas/v2/starter-kit.schema.json",
  "title": "LiNKlibraries Starter Kit extension revision 2",
  "type": "object",
  "additionalProperties": false,
  "required": ["schemaVersion", "schemaRevision", "entryId", "version", "extension"],
  "properties": {
    "schemaVersion": { "const": 2 },
    "schemaRevision": { "const": 2 },
    "entryId": { "$ref": "https://github.com/linktrend/LiNKlibraries/schemas/v2/common.schema.json#/$defs/entryId" },
    "version": { "$ref": "https://github.com/linktrend/LiNKlibraries/schemas/v2/common.schema.json#/$defs/semver" },
    "extension": { "$ref": "https://github.com/linktrend/LiNKlibraries/schemas/v2/common.schema.json#/$defs/starterKitExtension" }
  }
}
